{
  "execution_id": "exec-12345",
  "agent_identity": "sdlc-orchestrator-agent",
  "user_id": "user@example.com",
  "tenant_id": "banking-client-a",
  "repository": "payments-service",
  "tool": "wynxx.analyze_repository",
  "mcp_server": "wynxx-sdlc",
  "backend_mode": "real",
  "status": "success",
  "duration_ms": 12840,
  "model_armor_verdict": "allow",
  "artifacts": ["architecture-summary.md", "modernization-assessment.md"],
  "trace_id": "00-a1b2c3d4e5f60718293a4b5c6d7e8f90-1a2b3c4d5e6f0718-01",
  "timestamp": "2026-05-19T10:30:00Z"
}
