{
  "execution_id": "exec-7c41a9d2",
  "agent_identity": "sdlc-orchestrator-agent",
  "user_id": "developer@example.com",
  "tenant_id": "banking-client-a",
  "repository": "payments-service",
  "tool": "wynxx.analyze_repository",
  "mcp_server": "wynxx-sdlc",
  "backend_mode": "real",
  "status": "success",
  "duration_ms": 11920,
  "model_armor_verdict": "allow",
  "artifacts": [
    "architecture-summary.md",
    "api-overview.md",
    "test-recommendations.md",
    "modernization-assessment.md",
    "migration-plan-gcp.md"
  ],
  "trace_id": "00-7c41a9d2e5f60718293a4b5c6d7e8f90-1a2b3c4d5e6f0718-01",
  "timestamp": "2026-05-19T10:31:42Z"
}
